{
  "versao": "1.00",
  "chNfe": "35191200000000000000550010000012345678901234",
  "cnpjEmit": "12345678000190",
  "xNome": "ACME INDÃšSTRIA LTDA",
  "ieEmit": "123456789",
  "dhEmi": "2021-03-10T13:45:22Z",
  "tpNf": 1,
  "vNf": 1250.50,
  "digVal": "ABCDEF0123456789ABCDEF012345",
  "dhRecbto": "2021-03-10T13:46:01Z",
  "nProt": "135210000123456",
  "cSitNfe": 1
}
